[
  {
    "control_id": "A.5.1.1",
    "version": "2013",
    "name": "Policies for information security",
    "theme": "Information security policies",
    "description": "A set of policies for information security shall be defined, approved by management, published and communicated to employees and relevant external parties.",
    "guidance": "The information security policies should address requirements from the business strategy, regulations, legislation and current and projected information security threats. At its simplest it may be a single 'information security policy' document.",
    "control_type": [
      "Preventive"
    ],
    "related_controls": [
      "A.5.1.2"
    ],
    "new_in_2022": false,
    "iso_clause_refs": []
  },
  {
    "control_id": "A.5.1.2",
    "version": "2013",
    "name": "Review of the policies for information security",
    "theme": "Information security policies",
    "description": "The policies for information security shall be reviewed at planned intervals or if significant changes occur to ensure their continuing suitability, adequacy and effectiveness.",
    "guidance": "The policies should have an owner who has approved management responsibility for the development, review and evaluation of the policies. Review should include assessing opportunities for improvement of the organisation's policies and approach to managing information security in response to changes to the organisational environment, business circumstances, legal conditions or technical environment.",
    "control_type": [
      "Preventive",
      "Detective"
    ],
    "related_controls": [
      "A.5.1.1"
    ],
    "new_in_2022": false,
    "iso_clause_refs": []
  },
  {
    "control_id": "A.6.1.1",
    "version": "2013",
    "name": "Information security roles and responsibilities",
    "theme": "Organisation of information security",
    "description": "All information security responsibilities shall be defined and allocated.",
    "guidance": "Allocation of information security responsibilities should be done in accordance with the information security policies. Responsibilities for the protection of individual assets and for carrying out specific information security processes shall be identified.",
    "control_type": [
      "Preventive"
    ],
    "related_controls": [
      "A.6.1.2"
    ],
    "new_in_2022": false,
    "iso_clause_refs": []
  },
  {
    "control_id": "A.6.1.2",
    "version": "2013",
    "name": "Segregation of duties",
    "theme": "Organisation of information security",
    "description": "Conflicting duties and areas of responsibility shall be segregated to reduce opportunities for unauthorized or unintentional modification or misuse of the organization's assets.",
    "guidance": "Care should be taken that no single person can access, modify or use assets without authorization or detection. The initiation of an event should be separated from its authorization.",
    "control_type": [
      "Preventive"
    ],
    "related_controls": [
      "A.6.1.1"
    ],
    "new_in_2022": false,
    "iso_clause_refs": []
  },
  {
    "control_id": "A.6.1.3",
    "version": "2013",
    "name": "Contact with authorities",
    "theme": "Organisation of information security",
    "description": "Appropriate contacts with relevant authorities shall be maintained.",
    "guidance": "Organisations should have procedures that specify when and by whom authorities (e.g. law enforcement, regulatory bodies, supervisory authorities) shall be contacted and how identified information security incidents shall be reported in a timely manner.",
    "control_type": [
      "Preventive",
      "Corrective"
    ],
    "related_controls": [
      "A.6.1.4"
    ],
    "new_in_2022": false,
    "iso_clause_refs": []
  },
  {
    "control_id": "A.6.1.4",
    "version": "2013",
    "name": "Contact with special interest groups",
    "theme": "Organisation of information security",
    "description": "Appropriate contacts with special interest groups or other specialist security forums and professional associations shall be maintained.",
    "guidance": "Membership of special interest groups or forums should be considered as a means to improve knowledge about best practices and to stay up-to-date with relevant security information.",
    "control_type": [
      "Preventive"
    ],
    "related_controls": [
      "A.6.1.3"
    ],
    "new_in_2022": false,
    "iso_clause_refs": []
  },
  {
    "control_id": "A.6.1.5",
    "version": "2013",
    "name": "Information security in project management",
    "theme": "Organisation of information security",
    "description": "Information security shall be addressed in project management, regardless of the type of the project.",
    "guidance": "Information security should be integrated into the organisation's project management method(s) to ensure that information security risks are identified and addressed as part of a project.",
    "control_type": [
      "Preventive"
    ],
    "related_controls": [],
    "new_in_2022": false,
    "iso_clause_refs": []
  },
  {
    "control_id": "A.6.2.1",
    "version": "2013",
    "name": "Mobile device policy",
    "theme": "Organisation of information security",
    "description": "A policy and supporting security measures shall be adopted to manage the risks introduced by using mobile devices.",
    "guidance": "When using mobile devices, special care should be taken to ensure that business information is not compromised. The mobile device policy should consider the risks of working with mobile devices in unprotected environments.",
    "control_type": [
      "Preventive"
    ],
    "related_controls": [
      "A.6.2.2"
    ],
    "new_in_2022": false,
    "iso_clause_refs": []
  },
  {
    "control_id": "A.6.2.2",
    "version": "2013",
    "name": "Teleworking",
    "theme": "Organisation of information security",
    "description": "A policy and supporting security measures shall be implemented to protect information accessed, processed or stored at teleworking sites.",
    "guidance": "Organisations should only authorize teleworking activities if appropriate security arrangements and controls are in place and these comply with relevant security policy.",
    "control_type": [
      "Preventive"
    ],
    "related_controls": [
      "A.6.2.1"
    ],
    "new_in_2022": false,
    "iso_clause_refs": []
  },
  {
    "control_id": "A.7.1.1",
    "version": "2013",
    "name": "Screening",
    "theme": "Human resource security",
    "description": "Background verification checks on all candidates for employment shall be carried out in accordance with relevant laws, regulations and ethics and shall be proportional to the business requirements, the classification of the information to be accessed and the perceived risks.",
    "guidance": "Verification checks should take into account all relevant privacy, protection of personal data and employment based legislation, and should, where permitted, include identity verification, verification of academic and professional qualifications, and independent identity checks.",
    "control_type": [
      "Preventive"
    ],
    "related_controls": [
      "A.7.1.2"
    ],
    "new_in_2022": false,
    "iso_clause_refs": []
  },
  {
    "control_id": "A.7.1.2",
    "version": "2013",
    "name": "Terms and conditions of employment",
    "theme": "Human resource security",
    "description": "The contractual agreements with employees and contractors shall state their and the organization's responsibilities for information security.",
    "guidance": "The contractual obligations for employees and contractors should reflect the organisation's policies for information security. Terms and conditions of employment should include responsibilities that continue after termination.",
    "control_type": [
      "Preventive"
    ],
    "related_controls": [
      "A.7.1.1"
    ],
    "new_in_2022": false,
    "iso_clause_refs": []
  },
  {
    "control_id": "A.7.2.1",
    "version": "2013",
    "name": "Management responsibilities",
    "theme": "Human resource security",
    "description": "Management shall require all employees and contractors to apply information security in accordance with the established policies and procedures of the organization.",
    "guidance": "Management responsibilities should include ensuring that employees and contractors are aware of and motivated to fulfil their information security responsibilities.",
    "control_type": [
      "Preventive"
    ],
    "related_controls": [],
    "new_in_2022": false,
    "iso_clause_refs": []
  },
  {
    "control_id": "A.7.2.2",
    "version": "2013",
    "name": "Information security awareness, education and training",
    "theme": "Human resource security",
    "description": "All employees of the organization and, where relevant, contractors shall receive appropriate awareness education and training and regular updates in organizational policies and procedures, as relevant for their job function.",
    "guidance": "Security awareness training should begin at the time of joining the organisation and continue on an on-going basis to cover current policies, responsibilities, and security procedures.",
    "control_type": [
      "Preventive"
    ],
    "related_controls": [],
    "new_in_2022": false,
    "iso_clause_refs": []
  },
  {
    "control_id": "A.7.2.3",
    "version": "2013",
    "name": "Disciplinary process",
    "theme": "Human resource security",
    "description": "There shall be a formal and communicated disciplinary process in place to take action against employees who have committed an information security breach.",
    "guidance": "The formal disciplinary process should not be commenced without prior verification that a breach has occurred. It should provide for a graduated response that takes into account factors such as the nature and gravity of the breach and its impact on business.",